<!--
  ~ Copyright (c) since 2010
  ~ Dieses ist Bestandteil des NeoScio-Projektes und Eigentum der RapidPM - www.rapidpm.org (haftungsbeschraenkt)
  ~ Sven Ruppert : sven.ruppert@me.com
  ~ .
  -->

<!DOCTYPE documents SYSTEM "crawler_result_20100211.dtd">


<documents timestamp="">
    <document uri="">
        <doc_element status="" value=""/>
        <doc_element status="" value=""/>
        <doc_element status="" value=""/>
    </document>
    <document uri="">
        <doc_element status="" value=""/>
        <doc_element status="" value=""/>
        <doc_element status="" value=""/>
    </document>
    <document uri="">
        <doc_element status="" value=""/>
        <doc_element status="" value=""/>
        <doc_element status="" value=""/>
    </document>
</documents>
